id,title,type,description,source_id,degree,human_readable_id,community,level,node_details
693c9d45e9b248188fc8489bcab508ed,MOTHER,PERSON,"The mother of Belle and her siblings, who shares a moment with her husband and daughter at the fireside.",c7a06fa6f3d242a4b727c76637ef2060,3,108,5,0,"{'human_readable_id': 108, 'title': 'MOTHER', 'description': 'The mother of Belle and her siblings, who shares a moment with her husband and daughter at the fireside.', 'degree': 3}"
c617b22cccaf43e6900c0b9c07ab5aa4,FATHER,,,c7a06fa6f3d242a4b727c76637ef2060,3,109,5,0,"{'human_readable_id': 109, 'title': 'FATHER', 'description': '', 'degree': 3}"
22c7e48b3c6d4013a1d785220edaa2f7,IVY,OBJECT,"Ivy is a climbing plant that is commonly used in Christmas decorations, representing fidelity and eternity.",d89ea335037d44fcaf8315da239133ea,0,110,,0,"{'human_readable_id': 110, 'title': 'IVY', 'description': 'Ivy is a climbing plant that is commonly used in Christmas decorations, representing fidelity and eternity.', 'degree': 0}"
6829de70c8ff45c1b858328da38a1345,MISTLETOE,OBJECT,"Mistletoe is a plant traditionally hung during Christmas, under which people kiss, symbolizing love and peace.Mistletoe is a plant traditionally hung during Christmas, under which people kiss, symbolizing love and goodwill.","d89ea335037d44fcaf8315da239133ea,def0af8fa18c4986992f72d26e40df41",1,111,6,0,"{'human_readable_id': 111, 'title': 'MISTLETOE', 'description': 'Mistletoe is a plant traditionally hung during Christmas, under which people kiss, symbolizing love and peace.Mistletoe is a plant traditionally hung during Christmas, under which people kiss, symbolizing love and goodwill.', 'degree': 1}"
cea70a9b3be6490ab435b8476778fc02,TURKEY,OBJECT,"Turkey is a common dish served during Christmas feasts, symbolizing abundance and celebration.",d89ea335037d44fcaf8315da239133ea,0,112,,0,"{'human_readable_id': 112, 'title': 'TURKEY', 'description': 'Turkey is a common dish served during Christmas feasts, symbolizing abundance and celebration.', 'degree': 0}"
78ecd12342424b53997d423bb98e6dbd,PLUM-PUDDING,OBJECT,"Plum pudding is a traditional Christmas dessert, often associated with festive meals.",d89ea335037d44fcaf8315da239133ea,0,113,,0,"{'human_readable_id': 113, 'title': 'PLUM-PUDDING', 'description': 'Plum pudding is a traditional Christmas dessert, often associated with festive meals.', 'degree': 0}"
77f6b7e198514e1f975348b5fcef8c4b,PUNCH,OBJECT,"Punch is a mixed drink often served during celebrations, including Christmas, symbolizing hospitality and festivity.",d89ea335037d44fcaf8315da239133ea,0,114,,0,"{'human_readable_id': 114, 'title': 'PUNCH', 'description': 'Punch is a mixed drink often served during celebrations, including Christmas, symbolizing hospitality and festivity.', 'degree': 0}"
ef2ace8afefc473dae57ff108bc3d2c0,RUDDY LIGHT,OBJECT,"Ruddy light refers to the warm, glowing illumination that creates a festive atmosphere, often associated with Christmas.",d89ea335037d44fcaf8315da239133ea,0,115,,0,"{'human_readable_id': 115, 'title': 'RUDDY LIGHT', 'description': 'Ruddy light refers to the warm, glowing illumination that creates a festive atmosphere, often associated with Christmas.', 'degree': 0}"
94db4cdcf8c34f73bc30b782f1b4e5a4,CITY STREETS,GEO,"The city streets are depicted as lively and filled with people celebrating Christmas morning, despite the harsh weather.",def0af8fa18c4986992f72d26e40df41,3,116,7,0,"{'human_readable_id': 116, 'title': 'CITY STREETS', 'description': 'The city streets are depicted as lively and filled with people celebrating Christmas morning, despite the harsh weather.', 'degree': 3}"
5198ff229de94843b3f2a7195b340fa7,GROCERIES,ORGANIZATION,The Grocers' is a shop that is bustling with customers eager to purchase food and supplies for Christmas.,def0af8fa18c4986992f72d26e40df41,8,117,1,0,"{'human_readable_id': 117, 'title': 'GROCERIES', 'description': ""The Grocers' is a shop that is bustling with customers eager to purchase food and supplies for Christmas."", 'degree': 8}"
725d7662d80a453c94baf56ada273986,TURKEYS,OBJECT,"Turkeys are a common dish served during Christmas celebrations, representing feasting and abundance.",def0af8fa18c4986992f72d26e40df41,0,118,,0,"{'human_readable_id': 118, 'title': 'TURKEYS', 'description': 'Turkeys are a common dish served during Christmas celebrations, representing feasting and abundance.', 'degree': 0}"
7c80aa44c32b4949b5b528413bec6044,GEESE,OBJECT,"Geese are another type of poultry often prepared for Christmas meals, symbolizing festive gatherings.",def0af8fa18c4986992f72d26e40df41,0,119,,0,"{'human_readable_id': 119, 'title': 'GEESE', 'description': 'Geese are another type of poultry often prepared for Christmas meals, symbolizing festive gatherings.', 'degree': 0}"
6eb1caf8d9bb464780aa018c3fdca606,FRUIT,OBJECT,"Fruit is often part of Christmas celebrations, representing the bounty of the season.",def0af8fa18c4986992f72d26e40df41,1,120,1,0,"{'human_readable_id': 120, 'title': 'FRUIT', 'description': 'Fruit is often part of Christmas celebrations, representing the bounty of the season.', 'degree': 1}"
f5e4d5f81918453e904defc076aa4f32,PUDDINGS,OBJECT,"Puddings are traditional desserts served during Christmas, symbolizing indulgence and celebration.",def0af8fa18c4986992f72d26e40df41,1,121,1,0,"{'human_readable_id': 121, 'title': 'PUDDINGS', 'description': 'Puddings are traditional desserts served during Christmas, symbolizing indulgence and celebration.', 'degree': 1}"
4bf3f3dc526f4f6689d9b3f18d399862,SNOW,OBJECT,"Snow is a weather phenomenon that contributes to the Christmas atmosphere, often associated with winter festivities.",def0af8fa18c4986992f72d26e40df41,1,122,7,0,"{'human_readable_id': 122, 'title': 'SNOW', 'description': 'Snow is a weather phenomenon that contributes to the Christmas atmosphere, often associated with winter festivities.', 'degree': 1}"
142550ecb90f4e90822a966c47a701a6,CHESTNUTS,OBJECT,"Chestnuts are a seasonal treat often enjoyed during Christmas, symbolizing warmth and comfort.",def0af8fa18c4986992f72d26e40df41,1,123,1,0,"{'human_readable_id': 123, 'title': 'CHESTNUTS', 'description': 'Chestnuts are a seasonal treat often enjoyed during Christmas, symbolizing warmth and comfort.', 'degree': 1}"
ba3ff9e252b14495933f1de4b7336ffa,ONIONS,OBJECT,"Onions, particularly Spanish onions, are part of the festive food preparations during Christmas.",def0af8fa18c4986992f72d26e40df41,1,124,1,0,"{'human_readable_id': 124, 'title': 'ONIONS', 'description': 'Onions, particularly Spanish onions, are part of the festive food preparations during Christmas.', 'degree': 1}"
b210d732b80d4b7ebb2328de58369b2f,GRAPES,OBJECT,"Grapes are a fruit that can be part of the Christmas feast, symbolizing abundance.",def0af8fa18c4986992f72d26e40df41,0,125,,0,"{'human_readable_id': 125, 'title': 'GRAPES', 'description': 'Grapes are a fruit that can be part of the Christmas feast, symbolizing abundance.', 'degree': 0}"
2aae1c64fb914017b68feb9c54215a35,FIGS,OBJECT,"Figs are a type of fruit that may be enjoyed during Christmas, adding to the festive spread.",def0af8fa18c4986992f72d26e40df41,0,126,,0,"{'human_readable_id': 126, 'title': 'FIGS', 'description': 'Figs are a type of fruit that may be enjoyed during Christmas, adding to the festive spread.', 'degree': 0}"
75be77e020024f539b8a61fbdf3b727c,ALMONDS,OBJECT,"Almonds are nuts that can be part of Christmas treats and snacks, symbolizing indulgence.",def0af8fa18c4986992f72d26e40df41,1,127,1,0,"{'human_readable_id': 127, 'title': 'ALMONDS', 'description': 'Almonds are nuts that can be part of Christmas treats and snacks, symbolizing indulgence.', 'degree': 1}"
48716d04313c4247ab2b3b40b0963241,CINNAMON,OBJECT,"Cinnamon is a spice commonly used in Christmas baking and cooking, adding warmth and flavor.",def0af8fa18c4986992f72d26e40df41,1,128,1,0,"{'human_readable_id': 128, 'title': 'CINNAMON', 'description': 'Cinnamon is a spice commonly used in Christmas baking and cooking, adding warmth and flavor.', 'degree': 1}"
9702ec8520944cffa413dc1a47459ba5,RAISINS,OBJECT,"Raisins are dried grapes often used in Christmas recipes, symbolizing sweetness and tradition.",def0af8fa18c4986992f72d26e40df41,1,129,1,0,"{'human_readable_id': 129, 'title': 'RAISINS', 'description': 'Raisins are dried grapes often used in Christmas recipes, symbolizing sweetness and tradition.', 'degree': 1}"
e159592ca34544e0a9518345e83a7390,BELINDA CRATCHIT,PERSON,"Belinda Cratchit is Bob Cratchit's daughter, who participates in the Christmas festivities and helps prepare the meal.Belinda Cratchit is one of Bob and Mrs. Cratchit's daughters, who helps her mother with the Christmas preparations.","55b67878b08e4f0ea771dfc00e0bccfe,fc56ca33a03e4574b3fc66b813a99ca2",2,130,2,0,"{'human_readable_id': 130, 'title': 'BELINDA CRATCHIT', 'description': ""Belinda Cratchit is Bob Cratchit's daughter, who participates in the Christmas festivities and helps prepare the meal.Belinda Cratchit is one of Bob and Mrs. Cratchit's daughters, who helps her mother with the Christmas preparations."", 'degree': 2}"
adeca395141e49009dc5a2eafc9e837e,BAKERS' SHOPS,PLACE,"Bakers' shops are where people carry their dinners to be cooked, highlighting the community's reliance on these establishments during Christmas.",55b67878b08e4f0ea771dfc00e0bccfe,0,131,,0,"{'human_readable_id': 131, 'title': ""BAKERS' SHOPS"", 'description': ""Bakers' shops are where people carry their dinners to be cooked, highlighting the community's reliance on these establishments during Christmas."", 'degree': 0}"
c21b9a607e3c43e0874ebaeeee67165f,FOUR-ROOMED HOUSE,PLACE,Bob Cratchit's four-roomed house is where the Cratchit family gathers to celebrate Christmas together.,55b67878b08e4f0ea771dfc00e0bccfe,1,132,2,0,"{'human_readable_id': 132, 'title': 'FOUR-ROOMED HOUSE', 'description': ""Bob Cratchit's four-roomed house is where the Cratchit family gathers to celebrate Christmas together."", 'degree': 1}"
9032e8ba558c4a4ab00309898c87ef0a,SAGE AND ONION,FOOD,Sage and onion are traditional seasonings associated with the Christmas goose that the Cratchit family looks forward to.,55b67878b08e4f0ea771dfc00e0bccfe,0,133,,0,"{'human_readable_id': 133, 'title': 'SAGE AND ONION', 'description': 'Sage and onion are traditional seasonings associated with the Christmas goose that the Cratchit family looks forward to.', 'degree': 0}"
addf85fc53b54662923f36af6af0db95,CHRISTMAS DINNER,EVENT,"Christmas dinner is the meal that the Cratchit family prepares and looks forward to sharing together.The Christmas dinner is a festive meal prepared by the Cratchit family, symbolizing their unity and celebration despite their hardships.","55b67878b08e4f0ea771dfc00e0bccfe,b74b8953492640558f3b79064b4dbebd",4,134,2,0,"{'human_readable_id': 134, 'title': 'CHRISTMAS DINNER', 'description': 'Christmas dinner is the meal that the Cratchit family prepares and looks forward to sharing together.The Christmas dinner is a festive meal prepared by the Cratchit family, symbolizing their unity and celebration despite their hardships.', 'degree': 4}"
c5dd7119653a4700a15b7592ced2bdf1,MARTHA CRATCHIT,PERSON,"Martha Cratchit is another child in the Cratchit family, who works as an apprentice and shares her experiences with her family.Martha Cratchit is Bob Cratchit's daughter, who is caring and supportive of her family, especially her brother Tiny Tim.","f1be25e224b34d8aa45a93adeedad6be,fc56ca33a03e4574b3fc66b813a99ca2",3,135,2,0,"{'human_readable_id': 135, 'title': 'MARTHA CRATCHIT', 'description': ""Martha Cratchit is another child in the Cratchit family, who works as an apprentice and shares her experiences with her family.Martha Cratchit is Bob Cratchit's daughter, who is caring and supportive of her family, especially her brother Tiny Tim."", 'degree': 3}"
b4e6cad7aa0c4fed8fc0bf6b1296e48e,CRATCHIT FAMILY,ORGANIZATION,"The Cratchit family is a fictional family in Charles Dickens' ""A Christmas Carol,"" representing the struggles of the working class.The Cratchit family is a loving and close-knit family that celebrates Christmas together despite their financial struggles.","fc56ca33a03e4574b3fc66b813a99ca2,b74b8953492640558f3b79064b4dbebd",8,136,2,0,"{'human_readable_id': 136, 'title': 'CRATCHIT FAMILY', 'description': 'The Cratchit family is a fictional family in Charles Dickens\' ""A Christmas Carol,"" representing the struggles of the working class.The Cratchit family is a loving and close-knit family that celebrates Christmas together despite their financial struggles.', 'degree': 8}"
66eae01c42c44f75ab4eadc2c2dde541,CHRISTMAS DAY,EVENT,"Christmas Day is the holiday celebrated on December 25th, which is central to the narrative of Scrooge's transformation.Christmas Day is a holiday celebrated by the Cratchit family, marked by joy and togetherness, despite their hardships.Christmas Day is the holiday being celebrated by the Cratchit family, during which they toast to Mr. Scrooge.","f1be25e224b34d8aa45a93adeedad6be,fc56ca33a03e4574b3fc66b813a99ca2,df65d146e62547fa831a065fb04454cb",5,137,2,0,"{'human_readable_id': 137, 'title': 'CHRISTMAS DAY', 'description': ""Christmas Day is the holiday celebrated on December 25th, which is central to the narrative of Scrooge's transformation.Christmas Day is a holiday celebrated by the Cratchit family, marked by joy and togetherness, despite their hardships.Christmas Day is the holiday being celebrated by the Cratchit family, during which they toast to Mr. Scrooge."", 'degree': 5}"
984dee01d7594d7b94d90092a1292029,GOOSE,EVENT,"The goose is the centerpiece of the Cratchit family's Christmas dinner, symbolizing their celebration and the joy of the holiday.",fc56ca33a03e4574b3fc66b813a99ca2,2,138,2,0,"{'human_readable_id': 138, 'title': 'GOOSE', 'description': ""The goose is the centerpiece of the Cratchit family's Christmas dinner, symbolizing their celebration and the joy of the holiday."", 'degree': 2}"
b16392f323334772b03a9e807e227422,BELINDA,,,b74b8953492640558f3b79064b4dbebd,1,139,2,0,"{'human_readable_id': 139, 'title': 'BELINDA', 'description': '', 'degree': 1}"
57577b3242b241748a4fe7ab0f085e69,MR. SCROOGE,PERSON,"Mr. Scrooge is a character who experiences a transformation through the visits of spirits, reflecting on his life and the impact of his actions.Mr. Scrooge is a stingy and unfeeling man, often referred to as the Ogre of the family, whose name casts a dark shadow over the Cratchit family's Christmas.","f1be25e224b34d8aa45a93adeedad6be,3785ca8d5fa247c78d9b16f6e073c84c",6,140,2,0,"{'human_readable_id': 140, 'title': 'MR. SCROOGE', 'description': ""Mr. Scrooge is a character who experiences a transformation through the visits of spirits, reflecting on his life and the impact of his actions.Mr. Scrooge is a stingy and unfeeling man, often referred to as the Ogre of the family, whose name casts a dark shadow over the Cratchit family's Christmas."", 'degree': 6}"
68db3874807049fe8b8eae148dfb8db8,SCROOGE'S NIECE,PERSON,Scrooge's niece is a charming young woman who is concerned about her uncle's behavior and wishes he would join the family for Christmas.Scrooge's niece is a character who supports the festive spirit and expresses indignation towards Scrooge's negative views on Christmas.,"81fab2cc53a74845828dc3f8f0016432,234e7f789a1f43808d4fc2a8468770bf",3,141,6,0,"{'human_readable_id': 141, 'title': ""SCROOGE'S NIECE"", 'description': ""Scrooge's niece is a charming young woman who is concerned about her uncle's behavior and wishes he would join the family for Christmas.Scrooge's niece is a character who supports the festive spirit and expresses indignation towards Scrooge's negative views on Christmas."", 'degree': 3}"
36e74c79539c40d189bcf9d27756843c,LIGHTHOUSE,GEO,"A solitary lighthouse stands on a reef, symbolizing hope and guidance amidst the dark sea.",234e7f789a1f43808d4fc2a8468770bf,1,142,7,0,"{'human_readable_id': 142, 'title': 'LIGHTHOUSE', 'description': 'A solitary lighthouse stands on a reef, symbolizing hope and guidance amidst the dark sea.', 'degree': 1}"
f5bd59f6ec42432cba552db3f6685edf,SHIP,GEO,"A ship where the crew shares Christmas thoughts and camaraderie, representing the spirit of togetherness during the holiday.",234e7f789a1f43808d4fc2a8468770bf,1,143,7,0,"{'human_readable_id': 143, 'title': 'SHIP', 'description': 'A ship where the crew shares Christmas thoughts and camaraderie, representing the spirit of togetherness during the holiday.', 'degree': 1}"
415cf0b5aec54b7087ba00d8dc1dfc86,OLD WOMAN,PERSON,The old woman is a character who is part of the cheerful company celebrating Christmas with her family.,234e7f789a1f43808d4fc2a8468770bf,1,144,7,0,"{'human_readable_id': 144, 'title': 'OLD WOMAN', 'description': 'The old woman is a character who is part of the cheerful company celebrating Christmas with her family.', 'degree': 1}"
c3bf0584965845a1ba1b72fb12cf49e7,GENERATION,PERSON,"The next generation refers to the children of the old man and woman, indicating the continuity of family traditions.",234e7f789a1f43808d4fc2a8468770bf,1,145,7,0,"{'human_readable_id': 145, 'title': 'GENERATION', 'description': 'The next generation refers to the children of the old man and woman, indicating the continuity of family traditions.', 'degree': 1}"
36faf9b460b34d14896ab75bcc9d85e0,HELMSMAN,PERSON,The helmsman is a character on the ship who is part of the crew sharing Christmas thoughts.,234e7f789a1f43808d4fc2a8468770bf,1,146,7,0,"{'human_readable_id': 146, 'title': 'HELMSMAN', 'description': 'The helmsman is a character on the ship who is part of the crew sharing Christmas thoughts.', 'degree': 1}"
414817e00ac249d5b13696f18aed7758,LOOK-OUT,PERSON,"The look-out is a character on the ship, contributing to the sense of camaraderie among the crew.",234e7f789a1f43808d4fc2a8468770bf,1,147,7,0,"{'human_readable_id': 147, 'title': 'LOOK-OUT', 'description': 'The look-out is a character on the ship, contributing to the sense of camaraderie among the crew.', 'degree': 1}"
f5b9f832c1ad4d0e9d2e1435a703ba50,OFFICERS,PERSON,The officers are characters on the ship who participate in the Christmas spirit among the crew.,234e7f789a1f43808d4fc2a8468770bf,1,148,7,0,"{'human_readable_id': 148, 'title': 'OFFICERS', 'description': 'The officers are characters on the ship who participate in the Christmas spirit among the crew.', 'degree': 1}"
b1d46f2f4923460aba02df4d4fcaf933,OLD MAN,,,234e7f789a1f43808d4fc2a8468770bf,1,149,7,0,"{'human_readable_id': 149, 'title': 'OLD MAN', 'description': '', 'degree': 1}"
0ef94d31125b4002a4fc71844c4b4214,SCROOGE'S NIECE'S SISTERS,PERSON,Scrooge's niece's sisters are supportive of her opinions about their uncle and participate in family discussions.,81fab2cc53a74845828dc3f8f0016432,1,150,10,0,"{'human_readable_id': 150, 'title': ""SCROOGE'S NIECE'S SISTERS"", 'description': ""Scrooge's niece's sisters are supportive of her opinions about their uncle and participate in family discussions."", 'degree': 1}"
e14aea9452404235ae08a354b2c3aa0d,TOPPER,PERSON,Topper is a friend of Fred who engages in playful banter and has an interest in one of Scrooge's niece's sisters.Topper is a character who attends the Christmas party at Fred's house and is part of the joyful gathering.Topper is a character who plays blind man's buff and is noted for his humorous pursuit of the plump sister.,"a9651f8373914115acc21d411a45c0e9,81fab2cc53a74845828dc3f8f0016432,2e0ad1dfe538419fb2e86934a35e9a3a",5,151,10,0,"{'human_readable_id': 151, 'title': 'TOPPER', 'description': ""Topper is a friend of Fred who engages in playful banter and has an interest in one of Scrooge's niece's sisters.Topper is a character who attends the Christmas party at Fred's house and is part of the joyful gathering.Topper is a character who plays blind man's buff and is noted for his humorous pursuit of the plump sister."", 'degree': 5}"
4bec9d0f2aec4eeb92a0f366292899f2,SCROOGE'S NIECE'S PLUMP SISTER,,,81fab2cc53a74845828dc3f8f0016432,1,152,10,0,"{'human_readable_id': 152, 'title': ""SCROOGE'S NIECE'S PLUMP SISTER"", 'description': '', 'degree': 1}"
70349ab360f4467fab23f73ce8ef6c1c,PLUMP SISTER,PERSON,The plump sister is a character at the Christmas gathering who participates in games and is pursued by Topper during blind man's buff.,a9651f8373914115acc21d411a45c0e9,2,153,10,0,"{'human_readable_id': 153, 'title': 'PLUMP SISTER', 'description': ""The plump sister is a character at the Christmas gathering who participates in games and is pursued by Topper during blind man's buff."", 'degree': 2}"
402ea5d6bdfb48eea92cc40532a8b50b,SILKEN RUSTLINGS,EVENT,"Silken rustlings refer to the sounds made by the plump sister's dress as she moves during the games, contributing to the festive atmosphere.",a9651f8373914115acc21d411a45c0e9,0,154,,0,"{'human_readable_id': 154, 'title': 'SILKEN RUSTLINGS', 'description': ""Silken rustlings refer to the sounds made by the plump sister's dress as she moves during the games, contributing to the festive atmosphere."", 'degree': 0}"
675463f025f040df8074cd424c7cbf33,UNCLE SCROOGE,PERSON,"Uncle Scrooge is a character who experiences a transformation in his heart and spirit during the Christmas season, particularly influenced by the Ghosts of Christmas Past, Present, and Yet to Come.",07b78d484baf4627bc0ad07a6d7bf09a,7,155,7,0,"{'human_readable_id': 155, 'title': 'UNCLE SCROOGE', 'description': 'Uncle Scrooge is a character who experiences a transformation in his heart and spirit during the Christmas season, particularly influenced by the Ghosts of Christmas Past, Present, and Yet to Come.', 'degree': 7}"
98d9d48089ea479991b1a71ff59a9abc,IGNORANCE,PERSON,"Ignorance is depicted as a boy, representing societal neglect and the consequences of ignorance in humanity.",07b78d484baf4627bc0ad07a6d7bf09a,1,156,,0,"{'human_readable_id': 156, 'title': 'IGNORANCE', 'description': 'Ignorance is depicted as a boy, representing societal neglect and the consequences of ignorance in humanity.', 'degree': 1}"
b10a96a4d917476bbbaa5a0484f88ee0,WANT,PERSON,"Want is depicted as a girl, symbolizing the dire needs of the impoverished and the consequences of societal neglect.",07b78d484baf4627bc0ad07a6d7bf09a,1,157,,0,"{'human_readable_id': 157, 'title': 'WANT', 'description': 'Want is depicted as a girl, symbolizing the dire needs of the impoverished and the consequences of societal neglect.', 'degree': 1}"
b84d133d3207405fa018bbc0d594d356,MONEY,EVENT,"Money is a recurring theme in the conversations among the business men, reflecting their concerns about wealth and death.",6ac11eb9d6f046888bdae0cc38d1735c,1,158,6,0,"{'human_readable_id': 158, 'title': 'MONEY', 'description': 'Money is a recurring theme in the conversations among the business men, reflecting their concerns about wealth and death.', 'degree': 1}"
f652a81fa8af45feaccf4f028105955f,FUNERAL,EVENT,"The funeral is a topic of conversation among the business men, highlighting their indifference towards the deceased.",6ac11eb9d6f046888bdae0cc38d1735c,1,159,4,0,"{'human_readable_id': 159, 'title': 'FUNERAL', 'description': 'The funeral is a topic of conversation among the business men, highlighting their indifference towards the deceased.', 'degree': 1}"
2e737ce78e794b10b15bbfa22099dda9,DECEASED INDIVIDUAL,PERSON,"The deceased individual is the subject of discussion among the business men, who are indifferent to his death.",6ac11eb9d6f046888bdae0cc38d1735c,1,160,4,0,"{'human_readable_id': 160, 'title': 'DECEASED INDIVIDUAL', 'description': 'The deceased individual is the subject of discussion among the business men, who are indifferent to his death.', 'degree': 1}"
601353488186453ab50510fbc1e1d477,BUSINESS MEN,,,6ac11eb9d6f046888bdae0cc38d1735c,3,161,4,0,"{'human_readable_id': 161, 'title': 'BUSINESS MEN', 'description': '', 'degree': 3}"
71bde4692cb944ce81a5fe95e77ede45,OLD JOE,PERSON,"Old Joe is a character who appraises the items brought by others and engages in discussions about their value and the deceased.Old Joe is a grey-haired man who runs a shop dealing in old rags and bones, and he interacts with the other characters in a humorous manner.","7283c37e1f63448da02528e6cba5e078,3dbeb469767a42c782833b625d5152b2",9,162,3,0,"{'human_readable_id': 162, 'title': 'OLD JOE', 'description': 'Old Joe is a character who appraises the items brought by others and engages in discussions about their value and the deceased.Old Joe is a grey-haired man who runs a shop dealing in old rags and bones, and he interacts with the other characters in a humorous manner.', 'degree': 9}"
7a98d8c77bb4492984fd6d895eac3b4f,LAUNDRESS,PERSON,"The laundress is another woman who enters Old Joe's shop, participating in the conversation and laughter with the others.",7283c37e1f63448da02528e6cba5e078,3,163,3,0,"{'human_readable_id': 163, 'title': 'LAUNDRESS', 'description': ""The laundress is another woman who enters Old Joe's shop, participating in the conversation and laughter with the others."", 'degree': 3}"
91fbadebc9754e79a014cb2ee06da3dd,UNSEEN PHANTOM,PERSON,"The Unseen Phantom is a ghostly figure accompanying Scrooge, representing his contemplation of the future and moral lessons.",7283c37e1f63448da02528e6cba5e078,1,164,6,0,"{'human_readable_id': 164, 'title': 'UNSEEN PHANTOM', 'description': 'The Unseen Phantom is a ghostly figure accompanying Scrooge, representing his contemplation of the future and moral lessons.', 'degree': 1}"
5f7efee091644497b376ae91ab52f469,CHRISTMAS-TIME,EVENT,"Christmas-time is the season during which the events of the narrative take place, influencing the characters' actions and reflections.",7283c37e1f63448da02528e6cba5e078,1,165,6,0,"{'human_readable_id': 165, 'title': 'CHRISTMAS-TIME', 'description': ""Christmas-time is the season during which the events of the narrative take place, influencing the characters' actions and reflections."", 'degree': 1}"
