id,title,type,description,source_id,degree,human_readable_id,community,level,node_details
5447a6d934d54b6aa753bfba04f65f37,SCROOGE,PERSON,"Scrooge is a character who is skeptical and cold-hearted, often dismissing supernatural occurrences as 'humbug'.Scrooge is a character who experiences a transformation and reflects on the consequences of his actions and the impact of death.Scrooge is a character who is initially portrayed as miserly and unkind, but is confronted by spirits that lead him to reflect on his life and choices.Scrooge is a character who is reflecting on his life and the changes he hopes to make, influenced by the Ghost of Christmas Future.Scrooge is a character known for his transformation from a miserly old man to a joyful participant in Christmas festivities.Scrooge is a character who interacts with the Ghost and questions its reality and purpose.Mr. Scrooge is a character known for his stingy and unfeeling nature, who is later confronted about his attitudes towards the poor.Scrooge is a character who is visited by the Ghost of Christmas Yet to Come and reflects on his life and future.Scrooge is a tight-fisted, solitary old man who is the main character in the story, known for his cold demeanor and business acumen.Scrooge is a character who observes the scene of the ball and reflects on his past self, feeling a mix of nostalgia and agitation.Scrooge is a character who reflects on the nature of kindness and generosity, questioning the Spirit about the treatment of the poor on Christmas Day.Scrooge is a character who is portrayed as miserly and indifferent to the needs of others, particularly during Christmas.Scrooge is a character who experiences a transformation through the visits of spirits, reflecting on his past and relationships, particularly with his family and Christmas spirit.Scrooge is a character who is visited by the Ghost of Christmas Past and reflects on his life choices and their consequences.Scrooge is a character who experiences a transformation in his views on Christmas and generosity throughout the story.Scrooge is a character known for his miserly behavior and disdain for Christmas and social responsibility.Scrooge is an old miser who dislikes Christmas and is the uncle of Fred, often isolating himself from family gatherings.Scrooge is a character who experiences a transformation through the visits of spirits, reflecting on his past and future.Scrooge is a character known for his transformation from a miser to a generous man, embodying the spirit of Christmas.Scrooge is a character who is known for his transformation from a miser to a kinder person, and he reflects on the impact of death and family.Scrooge is a miserly character who despises Christmas and human connection, preferring solitude and wealth over joy and generosity.Scrooge is a character reflecting on his past, filled with memories and emotions during a winter day.Scrooge is a character who experiences a transformation on Christmas Day, showing kindness and generosity after a night of reflection and visits from spirits.Scrooge is a character who is reflecting on his past and learning lessons about generosity and kindness during Christmas.Scrooge is a character who reflects on his past and experiences a transformation during the Christmas season.Scrooge is a character who lives in a gloomy suite of rooms and is known for his melancholy demeanor, particularly on Christmas Eve.Scrooge is a character who experiences a transformation in his attitude towards Christmas and generosity, ultimately deciding to raise Bob Cratchit's salary and assist his family.Scrooge is a character who interacts with the Ghost of Christmas Past and reflects on his past life.Scrooge is a character who experiences a transformation after encounters with spirits, reflecting on his life and choices.","d89ea335037d44fcaf8315da239133ea,47524828f4904212b2c9b8d408af850a,09a3522139d54891a502ab1759c6d460,c03225d8a64a426c832168a1a9e1e2b5,d2541c036256448ab96216212f36b136,602c23233b534849a1d5de0f1d87b600,b44dcc61493a4fe19262f3190f7a412b,55b67878b08e4f0ea771dfc00e0bccfe,4f38628a0a0d4edcaa151b424005069f,b34e6e222cdf4a6b854ffc081a1dae9a,def0af8fa18c4986992f72d26e40df41,5fc00add744343b3957fb72c64f0ca5d,a21de8c8b34f425c94e2e2e64d5549a2,df65d146e62547fa831a065fb04454cb,2e0ad1dfe538419fb2e86934a35e9a3a,234e7f789a1f43808d4fc2a8468770bf,e62e5744849f43e0b49081b0f737841e,7283c37e1f63448da02528e6cba5e078,3a70fe14bf6d4563aacb394e6a7ebac4,a9651f8373914115acc21d411a45c0e9,27f9ff9cd23c4150bbaf694ef13a45fc,354d3a0f362a4d88b4b5234087abeda7,81fab2cc53a74845828dc3f8f0016432,affa4e84cfcb46b6957bd55fbbf85684,c7a06fa6f3d242a4b727c76637ef2060,82cdf76c7c594b399b60bf4a6d87f271,288b30debcac4ff7baeeb8384f95c4c2,6ac11eb9d6f046888bdae0cc38d1735c,b74b8953492640558f3b79064b4dbebd",73,22,6,0,"{'human_readable_id': 22, 'title': 'SCROOGE', 'description': ""Scrooge is a character who is skeptical and cold-hearted, often dismissing supernatural occurrences as 'humbug'.Scrooge is a character who experiences a transformation and reflects on the consequences of his actions and the impact of death.Scrooge is a character who is initially portrayed as miserly and unkind, but is confronted by spirits that lead him to reflect on his life and choices.Scrooge is a character who is reflecting on his life and the changes he hopes to make, influenced by the Ghost of Christmas Future.Scrooge is a character known for his transformation from a miserly old man to a joyful participant in Christmas festivities.Scrooge is a character who interacts with the Ghost and questions its reality and purpose.Mr. Scrooge is a character known for his stingy and unfeeling nature, who is later confronted about his attitudes towards the poor.Scrooge is a character who is visited by the Ghost of Christmas Yet to Come and reflects on his life and future.Scrooge is a tight-fisted, solitary old man who is the main character in the story, known for his cold demeanor and business acumen.Scrooge is a character who observes the scene of the ball and reflects on his past self, feeling a mix of nostalgia and agitation.Scrooge is a character who reflects on the nature of kindness and generosity, questioning the Spirit about the treatment of the poor on Christmas Day.Scrooge is a character who is portrayed as miserly and indifferent to the needs of others, particularly during Christmas.Scrooge is a character who experiences a transformation through the visits of spirits, reflecting on his past and relationships, particularly with his family and Christmas spirit.Scrooge is a character who is visited by the Ghost of Christmas Past and reflects on his life choices and their consequences.Scrooge is a character who experiences a transformation in his views on Christmas and generosity throughout the story.Scrooge is a character known for his miserly behavior and disdain for Christmas and social responsibility.Scrooge is an old miser who dislikes Christmas and is the uncle of Fred, often isolating himself from family gatherings.Scrooge is a character who experiences a transformation through the visits of spirits, reflecting on his past and future.Scrooge is a character known for his transformation from a miser to a generous man, embodying the spirit of Christmas.Scrooge is a character who is known for his transformation from a miser to a kinder person, and he reflects on the impact of death and family.Scrooge is a miserly character who despises Christmas and human connection, preferring solitude and wealth over joy and generosity.Scrooge is a character reflecting on his past, filled with memories and emotions during a winter day.Scrooge is a character who experiences a transformation on Christmas Day, showing kindness and generosity after a night of reflection and visits from spirits.Scrooge is a character who is reflecting on his past and learning lessons about generosity and kindness during Christmas.Scrooge is a character who reflects on his past and experiences a transformation during the Christmas season.Scrooge is a character who lives in a gloomy suite of rooms and is known for his melancholy demeanor, particularly on Christmas Eve.Scrooge is a character who experiences a transformation in his attitude towards Christmas and generosity, ultimately deciding to raise Bob Cratchit's salary and assist his family.Scrooge is a character who interacts with the Ghost of Christmas Past and reflects on his past life.Scrooge is a character who experiences a transformation after encounters with spirits, reflecting on his life and choices."", 'degree': 73}"
de291d5d4b924b95a99bd238dbd6ca50,MARLEY,PERSON,"Marley is Scrooge's deceased business partner who has been dead for seven years.Jacob Marley is Scrooge's deceased business partner who appears as a ghost, bound in chains, to warn Scrooge.Marley is Scrooge's deceased business partner, whose death is a pivotal point in the story.Marley is Scrooge's deceased partner, who has been dead for seven years and appears to Scrooge in a vision.","354d3a0f362a4d88b4b5234087abeda7,5fc00add744343b3957fb72c64f0ca5d,47524828f4904212b2c9b8d408af850a,e62e5744849f43e0b49081b0f737841e",1,23,6,0,"{'human_readable_id': 23, 'title': 'MARLEY', 'description': ""Marley is Scrooge's deceased business partner who has been dead for seven years.Jacob Marley is Scrooge's deceased business partner who appears as a ghost, bound in chains, to warn Scrooge.Marley is Scrooge's deceased business partner, whose death is a pivotal point in the story.Marley is Scrooge's deceased partner, who has been dead for seven years and appears to Scrooge in a vision."", 'degree': 1}"
bddd0bd5281c44dea8acb2d222535300,SCROOGE AND MARLEY,ORGANIZATION,Scrooge and Marley is the name of the firm that Scrooge and Marley operated together before Marley's death.,47524828f4904212b2c9b8d408af850a,1,24,6,0,"{'human_readable_id': 24, 'title': 'SCROOGE AND MARLEY', 'description': ""Scrooge and Marley is the name of the firm that Scrooge and Marley operated together before Marley's death."", 'degree': 1}"
5570703f900444758e2985a8aeff3070,HAMLET,EVENT,Hamlet is a play that is referenced to illustrate the concept of death and its implications in storytelling.,47524828f4904212b2c9b8d408af850a,1,25,6,0,"{'human_readable_id': 25, 'title': 'HAMLET', 'description': 'Hamlet is a play that is referenced to illustrate the concept of death and its implications in storytelling.', 'degree': 1}"
f863be903dc94188af3b0053ba17472d,UNKNOWN,,,47524828f4904212b2c9b8d408af850a,1,26,,0,"{'human_readable_id': 26, 'title': 'UNKNOWN', 'description': '', 'degree': 1}"
30b5aeea55c64972b17deabe622a45b0,SCROOGE'S NEPHEW,PERSON,"Scrooge's nephew is a character who embodies the spirit of Christmas and joy, contrasting with Scrooge's initial views.Scrooge's nephew is a cheerful character who embodies the spirit of Christmas and tries to persuade Scrooge to embrace the holiday.","affa4e84cfcb46b6957bd55fbbf85684,234e7f789a1f43808d4fc2a8468770bf",2,27,6,0,"{'human_readable_id': 27, 'title': ""SCROOGE'S NEPHEW"", 'description': ""Scrooge's nephew is a character who embodies the spirit of Christmas and joy, contrasting with Scrooge's initial views.Scrooge's nephew is a cheerful character who embodies the spirit of Christmas and tries to persuade Scrooge to embrace the holiday."", 'degree': 2}"
b71e4485103548f8bccf571dd4625f72,CHRISTMAS,EVENT,"Christmas is a holiday celebrated during the time of the narrative, symbolizing joy, generosity, and transformation.Christmas is a recurring theme in the narrative, representing joy, family, and the spirit of giving, which Scrooge reflects upon during his transformation.Christmas is the holiday that Scrooge vows to honor in his heart and celebrate throughout the year.Christmas is the festive season that Fred and Scrooge's niece are eager to celebrate with family, contrasting with Scrooge's disdain for it.Christmas is a festive season celebrated by many, characterized by charitable giving and family gatherings.Christmas is a holiday that evokes strong memories and emotions in Scrooge, particularly from his childhood.Christmas is a holiday celebrated on December 25th, symbolizing generosity, kindness, and family gatherings.Christmas is the holiday season during which Scrooge undergoes his transformation and decides to embrace generosity and kindness.Christmas is a holiday celebrated with joy, family gatherings, and games, representing the spirit of giving and togetherness.Christmas is a holiday celebrated on December 25th, marked by joy, giving, and family gatherings, which is central to the narrative.Christmas is a holiday celebrated with joy, laughter, and gatherings, which is central to the narrative and Scrooge's transformation.Christmas is a holiday celebrated on December 25th, marked by festivities and family gatherings, which Scrooge is reluctant to embrace.Christmas is a holiday celebrated on December 25th, associated with joy, giving, and family gatherings, which Scrooge vehemently rejects.Christmas is a holiday that is significant in the story, symbolizing family, kindness, and the spirit of giving.Christmas is the holiday being celebrated, symbolizing joy, generosity, and family gatherings.","81fab2cc53a74845828dc3f8f0016432,a46bd87c415a4b329e80a0a493c177ef,affa4e84cfcb46b6957bd55fbbf85684,c03225d8a64a426c832168a1a9e1e2b5,2e0ad1dfe538419fb2e86934a35e9a3a,234e7f789a1f43808d4fc2a8468770bf,288b30debcac4ff7baeeb8384f95c4c2,e62e5744849f43e0b49081b0f737841e,b44dcc61493a4fe19262f3190f7a412b,3a70fe14bf6d4563aacb394e6a7ebac4,def0af8fa18c4986992f72d26e40df41,07b78d484baf4627bc0ad07a6d7bf09a,55b67878b08e4f0ea771dfc00e0bccfe,a9651f8373914115acc21d411a45c0e9,a21de8c8b34f425c94e2e2e64d5549a2",21,28,7,0,"{'human_readable_id': 28, 'title': 'CHRISTMAS', 'description': ""Christmas is a holiday celebrated during the time of the narrative, symbolizing joy, generosity, and transformation.Christmas is a recurring theme in the narrative, representing joy, family, and the spirit of giving, which Scrooge reflects upon during his transformation.Christmas is the holiday that Scrooge vows to honor in his heart and celebrate throughout the year.Christmas is the festive season that Fred and Scrooge's niece are eager to celebrate with family, contrasting with Scrooge's disdain for it.Christmas is a festive season celebrated by many, characterized by charitable giving and family gatherings.Christmas is a holiday that evokes strong memories and emotions in Scrooge, particularly from his childhood.Christmas is a holiday celebrated on December 25th, symbolizing generosity, kindness, and family gatherings.Christmas is the holiday season during which Scrooge undergoes his transformation and decides to embrace generosity and kindness.Christmas is a holiday celebrated with joy, family gatherings, and games, representing the spirit of giving and togetherness.Christmas is a holiday celebrated on December 25th, marked by joy, giving, and family gatherings, which is central to the narrative.Christmas is a holiday celebrated with joy, laughter, and gatherings, which is central to the narrative and Scrooge's transformation.Christmas is a holiday celebrated on December 25th, marked by festivities and family gatherings, which Scrooge is reluctant to embrace.Christmas is a holiday celebrated on December 25th, associated with joy, giving, and family gatherings, which Scrooge vehemently rejects.Christmas is a holiday that is significant in the story, symbolizing family, kindness, and the spirit of giving.Christmas is the holiday being celebrated, symbolizing joy, generosity, and family gatherings."", 'degree': 21}"
4b375986c57f4e549d6f85fcc8e41fa8,COUNTING-HOUSE,PLACE,"Scrooge's counting-house is his place of business where he conducts his financial dealings and interacts with his clerk.The counting-house is the place where Scrooge and Marley conducted their business, representing their focus on money and the material world.","09a3522139d54891a502ab1759c6d460,affa4e84cfcb46b6957bd55fbbf85684",2,29,8,0,"{'human_readable_id': 29, 'title': 'COUNTING-HOUSE', 'description': ""Scrooge's counting-house is his place of business where he conducts his financial dealings and interacts with his clerk.The counting-house is the place where Scrooge and Marley conducted their business, representing their focus on money and the material world."", 'degree': 2}"
eb1aaf0af32446cc938e1322c1a7a23a,CLERK,PERSON,"The clerk works for Scrooge in the counting-house, enduring Scrooge's miserly behavior and trying to keep warm.The clerk is an employee of Scrooge who displays a warmer attitude towards Christmas than Scrooge.","affa4e84cfcb46b6957bd55fbbf85684,e62e5744849f43e0b49081b0f737841e",1,30,6,0,"{'human_readable_id': 30, 'title': 'CLERK', 'description': ""The clerk works for Scrooge in the counting-house, enduring Scrooge's miserly behavior and trying to keep warm.The clerk is an employee of Scrooge who displays a warmer attitude towards Christmas than Scrooge."", 'degree': 1}"
fd60d591eb8d409c97d177ff9474718b,POOR,GROUP,"The poor are referenced as individuals suffering during the festive season, in need of assistance and charity.",e62e5744849f43e0b49081b0f737841e,1,31,,0,"{'human_readable_id': 31, 'title': 'POOR', 'description': 'The poor are referenced as individuals suffering during the festive season, in need of assistance and charity.', 'degree': 1}"
7f05163cbbd647549586e0ec8d9497eb,GENTLEMEN,PERSON,The portly gentlemen are representatives seeking donations for the poor during Christmas.,e62e5744849f43e0b49081b0f737841e,1,32,,0,"{'human_readable_id': 32, 'title': 'GENTLEMEN', 'description': 'The portly gentlemen are representatives seeking donations for the poor during Christmas.', 'degree': 1}"
f15edf7f02aa4dab9c53d84b9de317df,NEPHEW,,,e62e5744849f43e0b49081b0f737841e,1,33,6,0,"{'human_readable_id': 33, 'title': 'NEPHEW', 'description': '', 'degree': 1}"
7dba2c6d54bf4f739ba3daaed58496bf,MANSION HOUSE,ORGANIZATION,"The Mansion House is the official residence of the Lord Mayor of London, where Christmas celebrations are organized.",3a70fe14bf6d4563aacb394e6a7ebac4,2,34,7,0,"{'human_readable_id': 34, 'title': 'MANSION HOUSE', 'description': 'The Mansion House is the official residence of the Lord Mayor of London, where Christmas celebrations are organized.', 'degree': 2}"
191bfe7973844ba99a32a23eae229fbf,CORNHILL,GEO,"Cornhill is a location where boys play, mentioned in the context of Christmas Eve celebrations.Cornhill is a street in London where Bob Cratchit and children are seen playing in celebration of Christmas Eve.","354d3a0f362a4d88b4b5234087abeda7,3a70fe14bf6d4563aacb394e6a7ebac4",2,35,7,0,"{'human_readable_id': 35, 'title': 'CORNHILL', 'description': 'Cornhill is a location where boys play, mentioned in the context of Christmas Eve celebrations.Cornhill is a street in London where Bob Cratchit and children are seen playing in celebration of Christmas Eve.', 'degree': 2}"
ffa3f57b64e34237bceb0091cc6b0dc7,CAMDEN TOWN,GEO,Camden Town is a district in London where Bob Cratchit lives and returns home after work.Camden Town is where Scrooge runs home to after playing on Cornhill.,"354d3a0f362a4d88b4b5234087abeda7,3a70fe14bf6d4563aacb394e6a7ebac4",2,36,2,0,"{'human_readable_id': 36, 'title': 'CAMDEN TOWN', 'description': 'Camden Town is a district in London where Bob Cratchit lives and returns home after work.Camden Town is where Scrooge runs home to after playing on Cornhill.', 'degree': 2}"
5da5dbcda6b54816a5bfc2b273aea622,ST. DUNSTAN,PERSON,"St. Dunstan is a historical figure referenced in the text, known for his legendary encounters with evil spirits.",3a70fe14bf6d4563aacb394e6a7ebac4,1,37,,0,"{'human_readable_id': 37, 'title': 'ST. DUNSTAN', 'description': 'St. Dunstan is a historical figure referenced in the text, known for his legendary encounters with evil spirits.', 'degree': 1}"
5bf988d6a05b41d1b11d4aada53e3072,CHURCH,GEO,"The church mentioned is an ancient structure in the vicinity of Scrooge's workplace, symbolizing tradition and the passage of time.",3a70fe14bf6d4563aacb394e6a7ebac4,1,38,6,0,"{'human_readable_id': 38, 'title': 'CHURCH', 'description': ""The church mentioned is an ancient structure in the vicinity of Scrooge's workplace, symbolizing tradition and the passage of time."", 'degree': 1}"
c331fb9cc27e4876a164062a27430447,GAS-PIPES,OBJECT,"Gas-pipes are infrastructure in the city being repaired by laborers, contributing to the setting of the story.",3a70fe14bf6d4563aacb394e6a7ebac4,1,39,,0,"{'human_readable_id': 39, 'title': 'GAS-PIPES', 'description': 'Gas-pipes are infrastructure in the city being repaired by laborers, contributing to the setting of the story.', 'degree': 1}"
290a8b2850114c49ade4404d61dea73d,LORD MAYOR,,,3a70fe14bf6d4563aacb394e6a7ebac4,1,40,7,0,"{'human_readable_id': 40, 'title': 'LORD MAYOR', 'description': '', 'degree': 1}"
1a2c8422626f4de1b9a5e075dd2654e9,EVIL SPIRIT,,,3a70fe14bf6d4563aacb394e6a7ebac4,1,41,,0,"{'human_readable_id': 41, 'title': 'EVIL SPIRIT', 'description': '', 'degree': 1}"
46fe7b7cb2084659bacbb31231c91f48,LABORERS,,,3a70fe14bf6d4563aacb394e6a7ebac4,1,42,,0,"{'human_readable_id': 42, 'title': 'LABORERS', 'description': '', 'degree': 1}"
9ce3baba4a8f4af2b515229826d5a854,CITY OF LONDON,GEO,The City of London is the area where Scrooge resides and is characterized by its gloomy atmosphere.,354d3a0f362a4d88b4b5234087abeda7,1,43,6,0,"{'human_readable_id': 43, 'title': 'CITY OF LONDON', 'description': 'The City of London is the area where Scrooge resides and is characterized by its gloomy atmosphere.', 'degree': 1}"
aa54724b6e3243e38ea0139b94d4b857,CHRISTMAS EVE,EVENT,"Christmas Eve is the evening before Christmas Day, celebrated with festivities and gatherings.Christmas Eve is the day when Scrooge experiences melancholy and reflects on his life.","602c23233b534849a1d5de0f1d87b600,354d3a0f362a4d88b4b5234087abeda7",3,44,0,0,"{'human_readable_id': 44, 'title': 'CHRISTMAS EVE', 'description': 'Christmas Eve is the evening before Christmas Day, celebrated with festivities and gatherings.Christmas Eve is the day when Scrooge experiences melancholy and reflects on his life.', 'degree': 3}"
a03bd1e9078c41c09a1f1967b0305166,BEDROOM,PLACE,"The bedroom is another room in Scrooge's chambers, contributing to the gloomy atmosphere of his living space.",354d3a0f362a4d88b4b5234087abeda7,1,45,6,0,"{'human_readable_id': 45, 'title': 'BEDROOM', 'description': ""The bedroom is another room in Scrooge's chambers, contributing to the gloomy atmosphere of his living space."", 'degree': 1}"
7b780c35c1b1444aaf43e6f4e09baed9,LUMBER-ROOM,PLACE,"The lumber-room is a storage area in Scrooge's chambers, filled with old items and contributing to the dreary environment.The lumber-room mentioned in Scrooge's surroundings, filled with various old items.","354d3a0f362a4d88b4b5234087abeda7,5fc00add744343b3957fb72c64f0ca5d",1,46,6,0,"{'human_readable_id': 46, 'title': 'LUMBER-ROOM', 'description': ""The lumber-room is a storage area in Scrooge's chambers, filled with old items and contributing to the dreary environment.The lumber-room mentioned in Scrooge's surroundings, filled with various old items."", 'degree': 1}"
4d1c892a504f4b3fb058bceee0d29df6,GRUEL,FOOD,"Gruel is a simple dish that Scrooge prepares for himself, indicating his frugal lifestyle.The little saucepan of gruel that Scrooge prepares for himself.","354d3a0f362a4d88b4b5234087abeda7,5fc00add744343b3957fb72c64f0ca5d",1,47,6,0,"{'human_readable_id': 47, 'title': 'GRUEL', 'description': 'Gruel is a simple dish that Scrooge prepares for himself, indicating his frugal lifestyle.The little saucepan of gruel that Scrooge prepares for himself.', 'degree': 1}"
ea53055e2377442181db3895c4057af6,FIRE-GUARD,OBJECT,"The old fire-guard is an item found in Scrooge's lumber-room, representing the neglected state of his belongings.",354d3a0f362a4d88b4b5234087abeda7,0,48,,0,"{'human_readable_id': 48, 'title': 'FIRE-GUARD', 'description': ""The old fire-guard is an item found in Scrooge's lumber-room, representing the neglected state of his belongings."", 'degree': 0}"
21f51625398b420aa919247c9caaebae,GAS-LAMPS,OBJECT,Gas-lamps are mentioned as a source of light that would not adequately illuminate Scrooge's dark entryway.,354d3a0f362a4d88b4b5234087abeda7,1,49,9,0,"{'human_readable_id': 49, 'title': 'GAS-LAMPS', 'description': ""Gas-lamps are mentioned as a source of light that would not adequately illuminate Scrooge's dark entryway."", 'degree': 1}"
61d96610c3214f05b48a391cd40481ba,SITTING-ROOM,,,354d3a0f362a4d88b4b5234087abeda7,1,50,6,0,"{'human_readable_id': 50, 'title': 'SITTING-ROOM', 'description': '', 'degree': 1}"
bd789779c8334fa8a9a896b79e601150,MARLEY'S GHOST,EVENT,"Marley's Ghost is a spectral figure that appears to Scrooge, warning him of the consequences of his actions and the need for change.The event of Marley appearing as a ghost to Scrooge, intending to convey a message about the consequences of his actions in life.","27f9ff9cd23c4150bbaf694ef13a45fc,5fc00add744343b3957fb72c64f0ca5d",2,51,6,0,"{'human_readable_id': 51, 'title': ""MARLEY'S GHOST"", 'description': ""Marley's Ghost is a spectral figure that appears to Scrooge, warning him of the consequences of his actions and the need for change.The event of Marley appearing as a ghost to Scrooge, intending to convey a message about the consequences of his actions in life."", 'degree': 2}"
a3981c1fe2b34ac883116d6132216d5b,BELL,OBJECT,A disused bell in Scrooge's room that begins to swing and ring loudly before the appearance of Marley's ghost.,5fc00add744343b3957fb72c64f0ca5d,0,52,,0,"{'human_readable_id': 52, 'title': 'BELL', 'description': ""A disused bell in Scrooge's room that begins to swing and ring loudly before the appearance of Marley's ghost."", 'degree': 0}"
