id,title,type,description,source_id,degree,human_readable_id,community,level,node_details
ef8dfb729c6f4ef0b6820a7a5bf928bb,CHAIN,OBJECT,"The heavy chain that Marley drags, made of cash-boxes, keys, padlocks, ledgers, deeds, and heavy purses wrought in steel.The chain symbolizes the burdens and consequences of one's actions in life, as worn by the Ghost, representing Jacob Marley's fate.","09a3522139d54891a502ab1759c6d460,5fc00add744343b3957fb72c64f0ca5d",1,53,8,0,"{'human_readable_id': 53, 'title': 'CHAIN', 'description': ""The heavy chain that Marley drags, made of cash-boxes, keys, padlocks, ledgers, deeds, and heavy purses wrought in steel.The chain symbolizes the burdens and consequences of one's actions in life, as worn by the Ghost, representing Jacob Marley's fate."", 'degree': 1}"
074a14b96de044858796e9507b7f7309,NIGHTCAP,OBJECT,The nightcap that Scrooge puts on before sitting down by the fire.,5fc00add744343b3957fb72c64f0ca5d,0,54,,0,"{'human_readable_id': 54, 'title': 'NIGHTCAP', 'description': 'The nightcap that Scrooge puts on before sitting down by the fire.', 'degree': 0}"
dda19a9b5fff4c2c83f26650d4a30022,DRESSING-GOWN,OBJECT,The dressing-gown that Scrooge wears while sitting by the fire.,5fc00add744343b3957fb72c64f0ca5d,0,55,,0,"{'human_readable_id': 55, 'title': 'DRESSING-GOWN', 'description': 'The dressing-gown that Scrooge wears while sitting by the fire.', 'degree': 0}"
d049e17f74db470896e025465440ae6c,SLIPPERS,OBJECT,The slippers that Scrooge puts on before sitting down to take his gruel.,5fc00add744343b3957fb72c64f0ca5d,0,56,,0,"{'human_readable_id': 56, 'title': 'SLIPPERS', 'description': 'The slippers that Scrooge puts on before sitting down to take his gruel.', 'degree': 0}"
c102f4e5d7ef4e2baef9ff988d116b05,CLOSET,OBJECT,"The closet in Scrooge's room, which he checks to ensure nobody is hiding inside.",5fc00add744343b3957fb72c64f0ca5d,0,57,,0,"{'human_readable_id': 57, 'title': 'CLOSET', 'description': ""The closet in Scrooge's room, which he checks to ensure nobody is hiding inside."", 'degree': 0}"
1cd876fc176f47cc98988d5b0dd6969e,COLD,STATE,"The cold that Scrooge has, which is mentioned as he has a cold in his head.",5fc00add744343b3957fb72c64f0ca5d,0,58,,0,"{'human_readable_id': 58, 'title': 'COLD', 'description': 'The cold that Scrooge has, which is mentioned as he has a cold in his head.', 'degree': 0}"
4bf16744a3e844f5a08a576de275850c,GHOST,PERSON,"The Ghost is a spectral figure that appears to Scrooge, representing a spirit that is bound to wander the earth due to its past actions.The Ghost is another term used for the Spirit, representing the past and memories in Scrooge's journey.The Ghost is a supernatural being that shows Scrooge the consequences of his actions and attitudes, particularly regarding Tiny Tim.The Ghost is a spectral figure that represents the future and the consequences of one's actions, guiding Scrooge through his visions.","09a3522139d54891a502ab1759c6d460,3785ca8d5fa247c78d9b16f6e073c84c,b74b8953492640558f3b79064b4dbebd,a21de8c8b34f425c94e2e2e64d5549a2",6,59,8,0,"{'human_readable_id': 59, 'title': 'GHOST', 'description': ""The Ghost is a spectral figure that appears to Scrooge, representing a spirit that is bound to wander the earth due to its past actions.The Ghost is another term used for the Spirit, representing the past and memories in Scrooge's journey.The Ghost is a supernatural being that shows Scrooge the consequences of his actions and attitudes, particularly regarding Tiny Tim.The Ghost is a spectral figure that represents the future and the consequences of one's actions, guiding Scrooge through his visions."", 'degree': 6}"
4252c23264d74bd793c8465cc7f8f1fd,JACOB MARLEY,PERSON,"Jacob Marley is the deceased business partner of Scrooge, who appears as a ghost to warn Scrooge about the consequences of his miserly ways.Jacob Marley is a ghost who appears to Ebenezer Scrooge to warn him about his life choices and the consequences of his actions after death.Jacob Marley is Scrooge's deceased business partner who appears as a ghost to warn Scrooge.Jacob Marley is the name of the Ghost, who reveals his fate to Scrooge and discusses the consequences of his life.Jacob Marley is the ghost of Scrooge's former business partner who appears to warn Scrooge about his life choices.","a46bd87c415a4b329e80a0a493c177ef,09a3522139d54891a502ab1759c6d460,c7a06fa6f3d242a4b727c76637ef2060,07b78d484baf4627bc0ad07a6d7bf09a,d80857713a1345f8820524bf2aadf0cf",6,60,7,0,"{'human_readable_id': 60, 'title': 'JACOB MARLEY', 'description': ""Jacob Marley is the deceased business partner of Scrooge, who appears as a ghost to warn Scrooge about the consequences of his miserly ways.Jacob Marley is a ghost who appears to Ebenezer Scrooge to warn him about his life choices and the consequences of his actions after death.Jacob Marley is Scrooge's deceased business partner who appears as a ghost to warn Scrooge.Jacob Marley is the name of the Ghost, who reveals his fate to Scrooge and discusses the consequences of his life.Jacob Marley is the ghost of Scrooge's former business partner who appears to warn Scrooge about his life choices."", 'degree': 6}"
462db93aac6b45ef977a4372d8e45e2f,SPIRIT,,"The Spirit is a phantom that guides Scrooge through his reflections on death and the lives of others affected by it.The Spirit represents the supernatural force guiding Scrooge towards redemption and change.The Spirit is a supernatural being guiding Scrooge through his reflections on Christmas and his past.The Spirit, specifically the Ghost of Christmas Present, embodies generosity and kindness, showing Scrooge the joy of Christmas and the importance of caring for the less fortunate.","a46bd87c415a4b329e80a0a493c177ef,09a3522139d54891a502ab1759c6d460,b34e6e222cdf4a6b854ffc081a1dae9a,234e7f789a1f43808d4fc2a8468770bf,55b67878b08e4f0ea771dfc00e0bccfe",8,61,6,0,"{'human_readable_id': 61, 'title': 'SPIRIT', 'description': 'The Spirit is a phantom that guides Scrooge through his reflections on death and the lives of others affected by it.The Spirit represents the supernatural force guiding Scrooge towards redemption and change.The Spirit is a supernatural being guiding Scrooge through his reflections on Christmas and his past.The Spirit, specifically the Ghost of Christmas Present, embodies generosity and kindness, showing Scrooge the joy of Christmas and the importance of caring for the less fortunate.', 'degree': 8}"
a763a266199b4be9bc8d6896a2394abe,THREE SPIRITS,EVENT,"The Three Spirits are supernatural beings that Jacob Marley warns Scrooge he will be haunted by, representing his past, present, and future.",d80857713a1345f8820524bf2aadf0cf,2,62,7,0,"{'human_readable_id': 62, 'title': 'THREE SPIRITS', 'description': 'The Three Spirits are supernatural beings that Jacob Marley warns Scrooge he will be haunted by, representing his past, present, and future.', 'degree': 2}"
279fe4e8b5fc4fb8a8da50f7c82da874,MANKIND,CONCEPT,"Mankind refers to humanity as a whole, which Jacob Marley expresses concern for in his conversation with Scrooge.",d80857713a1345f8820524bf2aadf0cf,0,63,,0,"{'human_readable_id': 63, 'title': 'MANKIND', 'description': 'Mankind refers to humanity as a whole, which Jacob Marley expresses concern for in his conversation with Scrooge.', 'degree': 0}"
c5d821acaf534dde8fc8f22e51fba86e,CHARITY,CONCEPT,"Charity is one of the key aspects of business that Jacob Marley emphasizes as important in life, alongside mercy and benevolence.",d80857713a1345f8820524bf2aadf0cf,0,64,,0,"{'human_readable_id': 64, 'title': 'CHARITY', 'description': 'Charity is one of the key aspects of business that Jacob Marley emphasizes as important in life, alongside mercy and benevolence.', 'degree': 0}"
fe4a330a6681488e99c157bc0522b1c0,BENEVOLENCE,CONCEPT,Benevolence is highlighted by Jacob Marley as a crucial element of his business that he neglected during his life.,d80857713a1345f8820524bf2aadf0cf,0,65,,0,"{'human_readable_id': 65, 'title': 'BENEVOLENCE', 'description': 'Benevolence is highlighted by Jacob Marley as a crucial element of his business that he neglected during his life.', 'degree': 0}"
41564e43c61a439bb5c0b167ac83423c,WIND,NATURAL PHENOMENON,"The wind is referenced by the Ghost as a means of travel, symbolizing the speed and urgency of the spirit's message.",d80857713a1345f8820524bf2aadf0cf,0,66,,0,"{'human_readable_id': 66, 'title': 'WIND', 'description': ""The wind is referenced by the Ghost as a means of travel, symbolizing the speed and urgency of the spirit's message."", 'degree': 0}"
31849a5832a84bc4a96f54bd782b070c,STAR,NATURAL PHENOMENON,"The blessed Star is mentioned as a guiding light that led the Wise Men, symbolizing hope and guidance that Marley reflects upon.",d80857713a1345f8820524bf2aadf0cf,0,67,,0,"{'human_readable_id': 67, 'title': 'STAR', 'description': 'The blessed Star is mentioned as a guiding light that led the Wise Men, symbolizing hope and guidance that Marley reflects upon.', 'degree': 0}"
b3334b1170b3419fb29e1f2f99756278,THE THREE SPIRITS,EVENT,"The Three Spirits are supernatural beings that visit Scrooge to guide him through his past, present, and future.",27f9ff9cd23c4150bbaf694ef13a45fc,2,68,6,0,"{'human_readable_id': 68, 'title': 'THE THREE SPIRITS', 'description': 'The Three Spirits are supernatural beings that visit Scrooge to guide him through his past, present, and future.', 'degree': 2}"
8d258ebdf5a749ad92aa72b01e3dcf95,THE CHURCH,ORGANIZATION,"The church is a setting in the story where the chimes signal the time, marking significant moments in Scrooge's journey.",27f9ff9cd23c4150bbaf694ef13a45fc,1,69,6,0,"{'human_readable_id': 69, 'title': 'THE CHURCH', 'description': ""The church is a setting in the story where the chimes signal the time, marking significant moments in Scrooge's journey."", 'degree': 1}"
f26ca556815548c189f48dadd3a682d9,THE BED,GEO,"Scrooge's bed is where he experiences the visitation of Marley's Ghost and the subsequent spirits, representing his isolation and introspection.",27f9ff9cd23c4150bbaf694ef13a45fc,1,70,6,0,"{'human_readable_id': 70, 'title': 'THE BED', 'description': ""Scrooge's bed is where he experiences the visitation of Marley's Ghost and the subsequent spirits, representing his isolation and introspection."", 'degree': 1}"
5eeccacf7c3d4d2b9240c0ea3f05fb62,THE CLOCK,GEO,The clock represents the passage of time and Scrooge's confusion about reality during his supernatural experiences.,27f9ff9cd23c4150bbaf694ef13a45fc,1,71,6,0,"{'human_readable_id': 71, 'title': 'THE CLOCK', 'description': ""The clock represents the passage of time and Scrooge's confusion about reality during his supernatural experiences."", 'degree': 1}"
b8f612d5b9ea4d519d41d5c7e9b6b698,THE FROST,,,27f9ff9cd23c4150bbaf694ef13a45fc,1,72,6,0,"{'human_readable_id': 72, 'title': 'THE FROST', 'description': '', 'degree': 1}"
34ed0a4e7f3d4c9c8c7d28030d06d9cb,WINTER DAY,EVENT,"A winter day described in the narrative, symbolizing a time of reflection and change for Scrooge.",d2541c036256448ab96216212f36b136,1,73,6,0,"{'human_readable_id': 73, 'title': 'WINTER DAY', 'description': 'A winter day described in the narrative, symbolizing a time of reflection and change for Scrooge.', 'degree': 1}"
69743a20e4084de0b33a43d0190ed0f7,HOLLY,OBJECT,"The branch of fresh green holly held by the Ghost of Christmas Past, symbolizing the season and the spirit of Christmas.Holly is a plant often associated with Christmas, used for decoration and symbolizing festivity.","d89ea335037d44fcaf8315da239133ea,d2541c036256448ab96216212f36b136",2,74,6,0,"{'human_readable_id': 74, 'title': 'HOLLY', 'description': 'The branch of fresh green holly held by the Ghost of Christmas Past, symbolizing the season and the spirit of Christmas.Holly is a plant often associated with Christmas, used for decoration and symbolizing festivity.', 'degree': 2}"
efc6b9ec7ea04357be5d6aae437457cb,ALI BABA,PERSON,Ali Baba is a character from a story who is remembered fondly by Scrooge as he reflects on his childhood.,a21de8c8b34f425c94e2e2e64d5549a2,1,75,6,0,"{'human_readable_id': 75, 'title': 'ALI BABA', 'description': 'Ali Baba is a character from a story who is remembered fondly by Scrooge as he reflects on his childhood.', 'degree': 1}"
efc26f3aa41f473a93a6e7e41f6cda87,VALENTINE,PERSON,"Valentine is a character mentioned by Scrooge, associated with his childhood memories.",a21de8c8b34f425c94e2e2e64d5549a2,1,76,6,0,"{'human_readable_id': 76, 'title': 'VALENTINE', 'description': 'Valentine is a character mentioned by Scrooge, associated with his childhood memories.', 'degree': 1}"
629609c27d944022a7f020563f8bd842,ORSON,PERSON,"Orson is a character mentioned by Scrooge, associated with his childhood memories.",a21de8c8b34f425c94e2e2e64d5549a2,1,77,6,0,"{'human_readable_id': 77, 'title': 'ORSON', 'description': 'Orson is a character mentioned by Scrooge, associated with his childhood memories.', 'degree': 1}"
c8c0ce856d9d4f8dbb585f9669d44667,DAMASCUS,GEO,Damascus is referenced in a story related to Scrooge's childhood memories.,a21de8c8b34f425c94e2e2e64d5549a2,1,78,6,0,"{'human_readable_id': 78, 'title': 'DAMASCUS', 'description': ""Damascus is referenced in a story related to Scrooge's childhood memories."", 'degree': 1}"
009408f725fd4b1f99087978ee07dbaa,MARKET-TOWN,LOCATION,"The market-town is a place Scrooge recognizes from his childhood, filled with memories.",a21de8c8b34f425c94e2e2e64d5549a2,1,79,6,0,"{'human_readable_id': 79, 'title': 'MARKET-TOWN', 'description': 'The market-town is a place Scrooge recognizes from his childhood, filled with memories.', 'degree': 1}"
6b4a499be3d646f18971d22546c9582b,MANSION,LOCATION,"The mansion of dull red brick is a significant location in Scrooge's past, representing his childhood home.",a21de8c8b34f425c94e2e2e64d5549a2,1,80,6,0,"{'human_readable_id': 80, 'title': 'MANSION', 'description': ""The mansion of dull red brick is a significant location in Scrooge's past, representing his childhood home."", 'degree': 1}"
1eb4f882df6440b491f51fb670ab4b94,POPULUS,PLANT,The leafless boughs of the poplar tree symbolize desolation and reflect Scrooge's emotional state.,a21de8c8b34f425c94e2e2e64d5549a2,1,81,6,0,"{'human_readable_id': 81, 'title': 'POPULUS', 'description': ""The leafless boughs of the poplar tree symbolize desolation and reflect Scrooge's emotional state."", 'degree': 1}"
594b1eebfc0e47c6a12f76b529cf9bef,PARROT,ANIMAL,"The Parrot is a character from Scrooge's childhood memories, associated with joy and nostalgia.",a21de8c8b34f425c94e2e2e64d5549a2,1,82,6,0,"{'human_readable_id': 82, 'title': 'PARROT', 'description': ""The Parrot is a character from Scrooge's childhood memories, associated with joy and nostalgia."", 'degree': 1}"
d1abd5e0f141494ea013027f2c5f67ae,SCHOOLMASTER,PERSON,"The schoolmaster is a character who interacts with Scrooge and his sister, representing authority and the educational environment of Scrooge's childhood.",c03225d8a64a426c832168a1a9e1e2b5,1,83,6,0,"{'human_readable_id': 83, 'title': 'SCHOOLMASTER', 'description': ""The schoolmaster is a character who interacts with Scrooge and his sister, representing authority and the educational environment of Scrooge's childhood."", 'degree': 1}"
e5e2370368f64ae6b6c3de330b3c362e,FRIDAY,PERSON,"Friday is another character mentioned by Scrooge, associated with the story of Robinson Crusoe, representing companionship and survival.",c03225d8a64a426c832168a1a9e1e2b5,1,84,6,0,"{'human_readable_id': 84, 'title': 'FRIDAY', 'description': 'Friday is another character mentioned by Scrooge, associated with the story of Robinson Crusoe, representing companionship and survival.', 'degree': 1}"
c90e3050eebc416d9e3ff70c01a03a1a,ROBIN CRUSOE,,,c03225d8a64a426c832168a1a9e1e2b5,1,85,6,0,"{'human_readable_id': 85, 'title': 'ROBIN CRUSOE', 'description': '', 'degree': 1}"
b73e58d203ff4fbe9b2a8c3df7e7734c,FEZZIWIG,PERSON,"Fezziwig is a character who hosts a joyful domestic ball, known for his ability to make people happy and for his lively dancing with his partner, Mrs. Fezziwig.Fezziwig is an old gentleman who was Scrooge's employer and is remembered fondly for his jovial nature and Christmas celebrations.","602c23233b534849a1d5de0f1d87b600,4f38628a0a0d4edcaa151b424005069f",13,86,0,0,"{'human_readable_id': 86, 'title': 'FEZZIWIG', 'description': ""Fezziwig is a character who hosts a joyful domestic ball, known for his ability to make people happy and for his lively dancing with his partner, Mrs. Fezziwig.Fezziwig is an old gentleman who was Scrooge's employer and is remembered fondly for his jovial nature and Christmas celebrations."", 'degree': 13}"
0772e1f4ddae4bb69bbb62b3c888c8e4,WELSH WIG,GEO,"The Welsh wig is a type of wig worn by the old gentleman Fezziwig, symbolizing his status and character.",602c23233b534849a1d5de0f1d87b600,0,87,,0,"{'human_readable_id': 87, 'title': 'WELSH WIG', 'description': 'The Welsh wig is a type of wig worn by the old gentleman Fezziwig, symbolizing his status and character.', 'degree': 0}"
c350c5a653c24f98860fcd2a4914b5fc,CITY,GEO,"The City represents the urban environment where Scrooge observes merchants and discussions about a deceased individual.The city represents the broader societal context in which Scrooge lives, filled with both wealth and poverty.The city represents the bustling environment where Scrooge and the Ghost travel, filled with activity during Christmas time.","602c23233b534849a1d5de0f1d87b600,6ac11eb9d6f046888bdae0cc38d1735c,07b78d484baf4627bc0ad07a6d7bf09a",4,88,6,0,"{'human_readable_id': 88, 'title': 'CITY', 'description': 'The City represents the urban environment where Scrooge observes merchants and discussions about a deceased individual.The city represents the broader societal context in which Scrooge lives, filled with both wealth and poverty.The city represents the bustling environment where Scrooge and the Ghost travel, filled with activity during Christmas time.', 'degree': 4}"
18e0db8ac73846cb86a9be14e4310cd9,MISS FEZZIWIGS,PERSON,"The three Miss Fezziwigs are Fezziwig's daughters, who are described as beaming and lovable during the festivities.",602c23233b534849a1d5de0f1d87b600,2,89,0,0,"{'human_readable_id': 89, 'title': 'MISS FEZZIWIGS', 'description': ""The three Miss Fezziwigs are Fezziwig's daughters, who are described as beaming and lovable during the festivities."", 'degree': 2}"
b8a92f3ffacc41108cf959ba261447af,FIDDLER,PERSON,"The fiddler is a musician who plays at Fezziwig's Christmas party, contributing to the festive atmosphere.",602c23233b534849a1d5de0f1d87b600,1,90,0,0,"{'human_readable_id': 90, 'title': 'FIDDLER', 'description': ""The fiddler is a musician who plays at Fezziwig's Christmas party, contributing to the festive atmosphere."", 'degree': 1}"
762da548828849cfb6fa2ae63a9369b1,COOK,PERSON,"The cook is a character who attends the Christmas celebration, bringing food and cheer to the gathering.",602c23233b534849a1d5de0f1d87b600,1,91,0,0,"{'human_readable_id': 91, 'title': 'COOK', 'description': 'The cook is a character who attends the Christmas celebration, bringing food and cheer to the gathering.', 'degree': 1}"
0608b0055c3e4628b4c6da054fb6e048,BAKER,PERSON,"The baker is the cousin of the housemaid, who also joins in the festivities at Fezziwig's warehouse.",602c23233b534849a1d5de0f1d87b600,1,92,0,0,"{'human_readable_id': 92, 'title': 'BAKER', 'description': ""The baker is the cousin of the housemaid, who also joins in the festivities at Fezziwig's warehouse."", 'degree': 1}"
303014b9154f4508b4119a6e25420379,MILKMAN,PERSON,"The milkman is the particular friend of the cook, who is present at the Christmas celebration.",602c23233b534849a1d5de0f1d87b600,1,93,0,0,"{'human_readable_id': 93, 'title': 'MILKMAN', 'description': 'The milkman is the particular friend of the cook, who is present at the Christmas celebration.', 'degree': 1}"
62334e80a87640c19ad362a64a2ace0f,YOUNG FOLLOWERS,PERSON,The six young followers are individuals who are romantically interested in the Miss Fezziwigs and attend the party.,602c23233b534849a1d5de0f1d87b600,1,94,0,0,"{'human_readable_id': 94, 'title': 'YOUNG FOLLOWERS', 'description': 'The six young followers are individuals who are romantically interested in the Miss Fezziwigs and attend the party.', 'degree': 1}"
b11da5bce336415ea267b91774f0be97,COLD CAKE,ITEM,Cold cake is a type of food served during the Christmas festivities at Fezziwig's celebration.,602c23233b534849a1d5de0f1d87b600,1,95,0,0,"{'human_readable_id': 95, 'title': 'COLD CAKE', 'description': ""Cold cake is a type of food served during the Christmas festivities at Fezziwig's celebration."", 'degree': 1}"
c030afa592a74888a236407d3ba626d6,NEGUS,ITEM,"Negus is a warm beverage served at the Christmas party, contributing to the festive spirit.",602c23233b534849a1d5de0f1d87b600,1,96,0,0,"{'human_readable_id': 96, 'title': 'NEGUS', 'description': 'Negus is a warm beverage served at the Christmas party, contributing to the festive spirit.', 'degree': 1}"
2982f4bc64014367975c9c22116dfd61,THE DOMESTIC BALL,EVENT,"The domestic ball is a festive gathering hosted by Fezziwig, featuring dancing, food, and a joyful atmosphere.",4f38628a0a0d4edcaa151b424005069f,2,97,6,0,"{'human_readable_id': 97, 'title': 'THE DOMESTIC BALL', 'description': 'The domestic ball is a festive gathering hosted by Fezziwig, featuring dancing, food, and a joyful atmosphere.', 'degree': 2}"
662839ad3b434544bf7bf0855105edc5,THE APPRENTICES,PERSON,"The apprentices are characters who express their gratitude and praise for Fezziwig during the domestic ball, reflecting on his positive influence.",4f38628a0a0d4edcaa151b424005069f,1,98,0,0,"{'human_readable_id': 98, 'title': 'THE APPRENTICES', 'description': 'The apprentices are characters who express their gratitude and praise for Fezziwig during the domestic ball, reflecting on his positive influence.', 'degree': 1}"
8e46f49ed7484492aa08ac7bc6a51ff7,DICK,,,4f38628a0a0d4edcaa151b424005069f,1,99,6,0,"{'human_readable_id': 99, 'title': 'DICK', 'description': '', 'degree': 1}"
31b2a77340404f12a1b0e8d41c23cfc5,YOUNG GIRL,PERSON,The young girl in the mourning dress represents Scrooge's past love and the emotional turmoil he experiences regarding lost opportunities.,82cdf76c7c594b399b60bf4a6d87f271,1,100,6,0,"{'human_readable_id': 100, 'title': 'YOUNG GIRL', 'description': ""The young girl in the mourning dress represents Scrooge's past love and the emotional turmoil he experiences regarding lost opportunities."", 'degree': 1}"
d5ec954357a0451b8126ddfcd18353da,WINTER FIRE,EVENT,"The winter fire is a setting that provides comfort and warmth, contrasting with Scrooge's emotional coldness.",82cdf76c7c594b399b60bf4a6d87f271,2,101,5,0,"{'human_readable_id': 101, 'title': 'WINTER FIRE', 'description': ""The winter fire is a setting that provides comfort and warmth, contrasting with Scrooge's emotional coldness."", 'degree': 2}"
cfc77568e45c40ec89106f710f3f5070,MATRON,PERSON,"The matron is a character who is a grown version of the young girl, representing the passage of time and change in Scrooge's life.",82cdf76c7c594b399b60bf4a6d87f271,2,102,5,0,"{'human_readable_id': 102, 'title': 'MATRON', 'description': ""The matron is a character who is a grown version of the young girl, representing the passage of time and change in Scrooge's life."", 'degree': 2}"
03d3f8bd67b24451acc97fdb459c2cb5,GOLDEN IDOL,OBJECT,"The golden idol represents wealth and materialism, which has displaced the young girl in Scrooge's affections.",82cdf76c7c594b399b60bf4a6d87f271,1,103,,0,"{'human_readable_id': 103, 'title': 'GOLDEN IDOL', 'description': ""The golden idol represents wealth and materialism, which has displaced the young girl in Scrooge's affections."", 'degree': 1}"
d0892ff7f58c43acb156ceb193e3dc2f,DOWERLESS GIRL,PERSON,"The dowerless girl represents the young girl in mourning dress, emphasizing her lack of wealth and the societal implications of this in Scrooge's choices.",82cdf76c7c594b399b60bf4a6d87f271,1,104,6,0,"{'human_readable_id': 104, 'title': 'DOWERLESS GIRL', 'description': ""The dowerless girl represents the young girl in mourning dress, emphasizing her lack of wealth and the societal implications of this in Scrooge's choices."", 'degree': 1}"
824a4cf18cd047549fc3b40038006bef,CHILDREN,PERSON,"The children are part of the family gathered around the old man, participating in the Christmas celebration.The children in the scene represent innocence and joy, contrasting with Scrooge's current life of isolation and regret.The group of children who express joy and excitement during the Christmas festivities.The children are depicted as representations of societal neglect, specifically through the figures of Ignorance and Want.","82cdf76c7c594b399b60bf4a6d87f271,c7a06fa6f3d242a4b727c76637ef2060,234e7f789a1f43808d4fc2a8468770bf,07b78d484baf4627bc0ad07a6d7bf09a",6,105,5,0,"{'human_readable_id': 105, 'title': 'CHILDREN', 'description': ""The children are part of the family gathered around the old man, participating in the Christmas celebration.The children in the scene represent innocence and joy, contrasting with Scrooge's current life of isolation and regret.The group of children who express joy and excitement during the Christmas festivities.The children are depicted as representations of societal neglect, specifically through the figures of Ignorance and Want."", 'degree': 6}"
8bf2e7d06bcd448ab95c7754ea0fece3,YOUNG GIRL IN MOURNING DRESS,,,82cdf76c7c594b399b60bf4a6d87f271,1,106,,0,"{'human_readable_id': 106, 'title': 'YOUNG GIRL IN MOURNING DRESS', 'description': '', 'degree': 1}"
85c095246fe94809bcb2d89d723de472,THE SECOND OF THE THREE SPIRITS,EVENT,The second spirit that visits Scrooge during his transformation process.,c7a06fa6f3d242a4b727c76637ef2060,1,107,6,0,"{'human_readable_id': 107, 'title': 'THE SECOND OF THE THREE SPIRITS', 'description': 'The second spirit that visits Scrooge during his transformation process.', 'degree': 1}"
